id,cataloger,digital_folder,description_level,volume_support,document_title,physical_reference,locations_mentioned,people_mentioned,institutions_mentioned,related_topics,document_summary,physical_issues,digitization_issues,cataloging_notes,review_date,collection_idno,parent_collection,collection_title,collection_description,collection_date,date
AHJCI.MFC.008.010,Javier Ricardo Ardila Gutiérrez,EAP1477_MFC_B08_Doc10_Lozano,Documento,57 folios de papel,Tercería excluyente propuesta por Felisa Lozano viuda de Lozano y Petrona Lozano en su propio nombre y en el de sus sobrinas Felicidad y Nieves Lozano en el caso C.A.P. de la Torre contra Manuel María Lozano,"Archivo Histórico del Juzgado del Circuito de Istmina, Fondo Minería y Familia, Caja 8, Documento 10",Cali|Condoto|Istmina|Nóvita,"Arango, Alberto|Ibargüen, Alejandro|Lozano, Ángel|Ibargüen, Antonio Crescencio|Ibargüen, Antonio|Llanos, Arturo|Barco, Augusto|Sánchez, Avelino|Olano, Carlos A|Cifuentes, César|Lozano, Claro|Sánchez, Deogracia|Caicedo, Eduardo|Pino, Eladio|Ibargüen, Estanislao|Ibargüen Lozano, Ester|Asprilla, Eusebio|Lozano Ibargüen, Eustaquia Felicidad|Ibargüen, Faustino|Valdez, Federico|Lozano Ibargüen, Felisa|Lozano Ibargüen, Faustino|Lozano, Floriano|Lozano Ibargüen, Francisco|Andrade, Genaro|Vega, Gerardo|Salazar, Gregorio|Lozano, Gumercinda|Cossio, Inocencio|Peña, Inocencio|Torre, J A P de la|Castillo, Jaime|Guzmán, José|María Ibargüen, José|María Lozano, José|María Torrijos, José|Alberto Lozano, Juan|Arboleda, Juan de Dios|Ibargüen Gamorano, Juan Isidoro|Lozano, Juan Francisco|Gamorano|Ibargüen, Juan Rufino |Ibargüen Lozano, Julio|Bernat, Luis E|Ramírez, Luis|Lozano, Manuel Dionisio|Flórez, Manuel|Sánchez, Manuel|Lozano, Manuel María|María de los Santos|Rojas, María del Rosario|Ibargüen Lozano, María Ester|Moreno, María Eustaquia|Ibargüen, María Hilaria|Ibargüen Moreno, María|Ibargüen, María Inocencia|Ibargüen Gamorano, María Saturnina|Asprilla, María Tiburcia|Mosquera, Melchor|Lozano, Nieves|Hurtado, Octavio|Palacios, Olimpo|Ibargüen Gamorano, Pablo Antonio|Lozano Ibargüen, Petrona|Sánchez, Rafael|Miller, Ramón|Peñate, Roque|Ibargüen, Rufina|Lozano, Salomón|Ibargüen, Saturnina|Abadía Arango, Sergio|Yates Polo, Tomás|Lozano, Víctor|Sánchez, Urbano|Mosquera, Víctor|Mosquera, Wenceslao|Segura, Fernando",,administración varios|administración-judicial,"Condoto. Expediente por tercera excluyente contra Manuel María Lozano por Petrona y Felisa Lozano. Incluye factura de honorarios del perito Tomás Yates Polo por el avalúo de bienes, 31 de octubre de 1930 (documento sin foliación).

Genaro Andrade, a nombre de Saturnina Andrade, solicita al juez del circuito una copia de la sentencia de declaratoria de herederos de Estanislao Ibargüen o de su testamento, 30 de julio de 1913 (ff. 1-5), incluye copia del testamento (21 de noviembre de 1906) autenticada por el escribano Fernando Segundo, (ff. 2r-5v); Gregorio Barco, a nombre de Felisa y Petrona Lozano, solicita la tercera excluyente ante el juez del circuito, 18 noviembre de 1930, va con aprobación del 24 de noviembre de 1930 (ff. 6-7); edicto de la Secretaría del Juzgado Primero del Circuito de Istmina en el que se admite la propuesta de tercería excluyente y se da un plazo de 30 días para su resolución, 25 de noviembre de 1930 (f. 8); otorgamiento de poder por Petrona Lozano a su sobrino, Ángel Lozano, tramitado ante el Juzgado del Primer Circuito de Istmina, 10 de diciembre de 1930 (f. 9); edicto de la Secretaría del Juzgado Primero del Circuito de Istmina que comunica la admisión la tercería excluyente, 3 de diciembre de 1930 (f. 10); Manuel María Lozano solicita al juez primero del Circuito que se abra el juicio ordinario en el proceso de tercería en su contra, 26 de enero de 1931 (ff. 11-12); edicto de la Secretaría del Juzgado Primero del Circuito de Istmina que comunica el rechazo el pedimiento de fianza de costas en el juicio ordinario, 25 de febrero de 1931 (f. 13); Luis Enrique Bernat se opone a la petición de tercería excluyente y aduce que las demandantes Petrona y Felisa Lozano no poseen títulos de propiedad del solar en disputa, 6 de marzo de 1931 (ff. 14-15); oficio número 448 del Juzgado Primero del Circuito de Istmina, Jaime Castillo, juez primero, solicita al juez municipal de Condoto hacer comparecer en juzgado a Felisa, Petronila y Manuel María Lozano, 6 de mayo de 1931, incluye declaraciones de Rufina Ibargüen, Juan de Dios Arboleda, Deogracias Sánchez, (ff. 16-22); edicto de la Secretaría del Juzgado Primero del Circuito de Istmina en el que se comunica la aprobación de las declaraciones recibidas como pruebas en favor de Felisa y Petrona Lozano en el proceso contra Manuel María Lozano, 21 de julio de 1831 (f. 23); edicto de la Secretaría del Juzgado Primero del Circuito de Istmina en el que se comunica el paso de los autos a las partes en contienda en el proceso de Felisa y Petrona Lozano contra Manuel María Lozano para que aleguen en definitiva, 1 de agosto de 1831 (f. 24); Ángel Lozano, a nombre de su tía, Petrona Lozano, solicita que los testigos ratifiquen la declaración que rindieron en el proceso contra Manuel María Lozano. Así mismo, piden el desembargo del solar, la cancelación de la inscripción y condenar en costas a la contraparte por no haber probado la propiedad ni posesión del inmueble embargado, 12 de agosto de 1831 (f. 25); Felisa Lozano de Lozano solicita que los testigos ratifiquen la declaración que rindieron en el proceso contra Manuel María Lozano. Así mismo, piden el desembargo del solar, la cancelación de la inscripción y condenar en costas a la contraparte por no haber probado la propiedad ni posesión del inmueble embargado, 14 de agosto de 1831 (f. 26); oficio 785 del Juzgado Primero del Circuito de Istmina, el juez primero traslada al juez municipal de Condoto el asunto civil entre Petrona y Felisa Lozano contra Manuel María Lozano y solicita hacer comparecer a las partes involucradas, 3 de agosto de 1931 (f. 27); Manuel María Lozano presenta un memorial de alegación en el proceso en su contra, 1 de septiembre de 1931 (ff. 28-29); Luis Enrique Bernat solicita al juez primero del Circuito de Istmina declarar el derecho de Manuel María Lozano sobre el lote en contienda con Petrona y Felisa Lozano y condenar en costas a las terceristas, 8 de septiembre de 1831 (ff. 30-33); oficio 956 del Juzgado Primero del Circuito de Istmina, Jaime Castillo, juez primero, solicita al juez municipal de Condoto hacer comparecer a Petrona y Felisa Lozano y Manuel María Lozano, 3 de agosto de 1931 (f. 34); Eusebio Asprilla, secretario del Juzgado Primero del Circuito de Istmina, remite al secretario del Tribunal Superior de Cali el expediente de tercería excluyente introducida por Petrona y Felisa Lozano contra Manuel María Lozano, 30 de octubre de 1931 (f. 35); edicto de la Secretaría del Juzgado Primero del Circuito de Istmina en el que se acepta la apelación interpuesta por Petrona Lozano contra la sentencia definitiva en el proceso que interpuso contra Manuel María Lozano, e indica que las partes deben ponerse a derecho en la segunda instancia, 13 de octubre de 1931 (ff. 37); edicto de la Secretaría de la Sala de lo Civil del Tribunal Superior de Cali que comunica a las partes del proceso de Petrona y Felisa Lozano contra Manuel María Lozano el recibo de los autos, 25 de noviembre de 1931 (f. 38); edicto de la Secretaría de la Sala de lo Civil del Tribunal Superior de Cali que comunica el traslado de los autos a las partes enfrentadas en el proceso de Petrona y Felisa Lozano contra Manuel María Lozano, 23 de enero de 1932, incluye relatoría de la audiencia pública del 28 de marzo de 1932 y el estudio del magistrado Carlos Olano sobre el proceso en el que confirma el fallo del 12 de septiembre de 1931 en favor Manuel María Lozano (ff. 39-41); edicto de la Secretaría de la Sala de lo Civil del Tribunal Superior de Cali en que se comunica la aceptación del fallo del 12 de septiembre de 1931 proferido por el juez primero del Circuito Judicial de Istmina el en proceso de Petrona y Felisa Lozano contra Manuel María Lozano, 10 de mayo de 1932, incluye liquidación de intereses y liquidación de costas tramitadas el 16 de noviembre de 1932 (f. 42-44); edicto de la Secretaría del Juzgado Primero del Circuito de Istmina en que se comunica la remisión de liquidación de intereses y costas en el proceso de Petrona y Felisa Lozano contra Manuel María Lozano, 19 de noviembre de 1932, (ff. 45-46); edicto de la Secretaría del Juzgado Primero del Circuito de Istmina en que se comunica el remate en subasta pública del bien raíz embargado en el proceso, 10 de marzo de 1933, (ff. 47); aviso de la Secretaría del Juzgado Primero del Circuito de Istmina sobre el avalúo y remate del solar embargado en el proceso de Luis E. Bernat contra Manuel María Lozano, 16 de marzo de 1933, va con tres duplicados (ff. 48-51); Eusebio Asprilla, secretario del Juzgado Primero del Circuito de Istmina, remite al juez municipal de Condoto los carteles de remate del bien embargado en el proceso de Luis E. Bernat contra Manuel María Lozano, 18 de marzo de 1833 (f. 52); comunicación de Jaime Castillo, juez primero del Circuito de Istmina, al juez municipal de Condoto en el que remite cuatro ejemplares de los carteles de remate en el proceso de Luis E. Bernat contra Manuel María Lozano y solicita fijarlos, 16 de marzo de 1933 (f. 53); aviso de la Secretaría del Juzgado Primero del Circuito de Istmina sobre el avalúo y remate del solar embargado en el proceso de Luis E. Bernat contra Manuel María Lozano, 16 de marzo de 1933 (ff. 56); recibo 96 de la Administración de Correos de Istmina, 21 de noviembre de 1931 (f. 57); diligencias de remate del solar embargado en el proceso contra Manuel María Lozano, 18 de abril de 1933 (ff. 58-59); cuenta de cobro de Olimpo Palacios a Luis E. Bernat por sus servicios como pregonero en el remate del bien embargado en el juicio contra Manuel María Lozano, 18 de abril de 1933 (f. 60); edicto de la Secretaría del Juzgado Primero del Circuito de Istmina en que se comunica el remate del bien embargado en el proceso de Luis E. Bernat contra Manuel María Lozano, adjudicado al mismo Bernat, adicionalmente, se sanciona el levantamiento del embargo y la entrega del solar y títulos de propiedad, 25 de abril de 1933, (ff. 61); renta de registro 116, de la Administración Subalterna del Tesoro de la Intendencia Nacional del Chocó, certifica que Luis E. Bernat consignó $0,50 por derechos de registro, abril 28 de 1933 (f. 62); boleta de registro 15, de la Recaudación de Hacienda de la Intendencia Nacional del Chocó, certifica que Luis E. Bernat consignó $0,25 por registro de la sentencia aprobatoria del remate del solar perteneciente a Manuel María Lozano, abril 28 de 1933 (f. 62); oficio 382 del Juzgado Primero del Circuito de Istmina, Jaime Castillo, juez primero, informa al registrador de Instrumentos Púbicos del Circuito que se levantó el embargo sobre un solar en Condoto que era de propiedad de Manuel María Lozano, 2 de mayo de 1933 (f. 63); recibo 32 de la administración del periódico El Heraldo, certifica que Luis E. Bernat canceló $2,37 para la publicación de un edicto, 31 de marzo de 1933 (f. 64); denuncia de Luis E. Bernat ante el juez primero del Circuito de Istmina sobre la propiedad de Manuel María Lozano de un bien adicional que puede servir para cubrir capital, intereses y costas, 26 de junio de 1933 (ff. 65-66); oficio 57 del Juzgado Primero del Circuito de Istmina, Marino Abadía Valencia, juez primero, informa al registrador de Instrumentos Púbicos del Circuito que se sancionó el embargo de un solar en Condoto que es de propiedad de Manuel María Lozano, 2 de mayo de 1933 (f. 67); porte de carga número 58 por remisión de documentos del Juzgado Primero del Circuito de Istmina al juez municipal de Condoto, 24 de marzo de 1934 (f. 68); el secretario del Juzgado Primero del Circuito de Istmina informa al juez municipal de Condoto que se sancionó el embargo de un solar en Condoto que es de propiedad de Manuel María Lozano, 23 de marzo de 1933 (ff. 69-71).","
Tiene diferentes números de folio",,,"Descrito por Javier Ricardo Ardila Gutiérrez el 2023-02-02, revisado por Daniel Varela Corredor y Kelly López Roldán el 2024-02-20",AHJCI.MFC.008,AHJCI.MFC,Caja 8,"Esta caja contiene 14 procesos judiciales iniciados entre 1926 y 1930 en la cuenca del río San Juan. Incluye varios casos por posesión y propiedad minera, e involucra actores como la Compañía Minera Chocó Pacífico, Antonio Asprilla, Hermenegildo Bonilla y Rito E. Florez. También hay casos de cobros y heridas, y se incluye algunos conflictos familiares como la división de un terreno agrícola al interior de una familia indígena y un juicio de separación de bienes en una sociedad conyugal sin implicar divorcio.
 ",1926 - 1930,1930
AHJCI.MFC.008.011,Yurleyda Perea Cuesta,EAP1477_MFC_B08_Doc11_DelgadoandDelgadovsChocoPacifico,Documento,10 folios de papel,Moisés Delgado M. y Arquímedes Delgado R. contra la Compañía Chocó Pacífico por derechos sobre la mina Playa de Oro,"Archivo Histórico del Juzgado del Circuito de Istmina, Fondo Minería y Familia, Caja 9, Documento 11",Cali|Istmina|Mina Playa de Oro|El Tránsito|San Juan|Tadó|Corregimiento de Pureto|Medellín|Mumbú|Terrenos Anamúguera|Quebrada La Onda|Mina Pureto n°2|Quibdó|Cima Alto del Tomín|Punto del Puente Antiguo|Corregimiento del Carmelo,"Delgado M, Moisés|Delgado, Arquímides|Pérez, Lucas Díaz|David Delgado, José|Mosquera, Heriberto|Mosquera, Macedonio|Ramírez, José|Mosquera, Guillermo|López, Roso|Mosquera, Sixto|Mosquera, Marcelino|Mosquera, Rafaela|Perea M, José Joaquín|Murillo, Pioquinto|Perea, Antonio S|Robledo, Juan I|Mosquera, Víctor Luciano|Mosquera, José María|Benítez, Fulgencio|Hinestroza, Juan E|Castillo, Jaime|Santacoloma, Manuel E|Misas, Abraham|Roa, Pompilio|Serrano, Pedro Elías|Sánchez Leudo, Rafael|Sánchez, Jesús María|Benítez, Felipe Santiago|Marshall, Newton C|Ruiz Toral, Isaac|Caro, Santiago|Hormaza, José Ignacio|Arrunategui, Ángel A|Iragorri, Isaías|Valencia Lozano, Jorge",,administración-judicial|minas|minería|judicial,"El apoderado de los señores Moisés Delgado y José David Delgado, el señor Lucas Díaz Pérez, manifiesta ante el Juez Primero del Circuito que aún está abierto a prueba el juicio ordinario sobre nulidad de unos títulos de derecho de la mima de aluvión de oro y platino denominado Playa de Oro, pide se sirva decretar las diligencias siguientes y tenerlas como prueba:

1. Copia autorizada de las diligencias adelantadas por los señores Moisés y Lucas para obtener la adjudicación de dicha mina.

2. Copia de la escritura pública, por la cual se protocolizó, el auto del juzgado de este circuito (Istmina), donde se abrió sucesión del señor José David Delgado y fue declarado su heredero el señor Moisés.

3. Pide que “el señor Roso López declare si, para el año de 1920, desempeñaba en Istmina el cargo de abogado de la Compañía Minera Chocó Pacífico”.

4. Pide también que se libre copia autorizada de algunas escrituras, entre ellas la del señor Fulgencio, en 1920, que muestra la venta que éste hizo de la mina Playa de Oro a la Compañía Chocó Pacífico, para que se verifique que esté debidamente registrada.

5. Que se sirva también decretar una inspección en los terrenos Anamúguera y Orilla de San Juan, o sea Playa de Oro, para que los peritos conocedores de los terrenos certifiquen que Anamúguera es distinto al que se conoce como Playa de Oro u Orilla de San Juang.

De acuerdo con el descubridor de la mina de aluvión de oro y platino llamada Playa de Oro, ya finado, por medio de dichas copias solicitadas, la mina se denunció para varios y de las 24 acciones en que se considera dividida esta mina, se hizo la siguiente distribución: para José David Delgado, seis y media acciones; para Moisés Delgado, seis y media acciones; para Arquímedes Delgado, una acción; para el suscrito, ya finado, Felipe, 10 acciones.

En un memorial, el señor Marshall le dice al Intendente Nacional del Chocó que en su carácter de representante de la Compañía Minera se opone al denuncio por parte de Lucas Díaz de la mina Playa de Oro y otros, denuncio que fundaron en un supuesto abandono de dicha mina. Marshall dice que es falsa tal suposición ya que la Compañía tiene título minero y ha pagado el impuesto correspondiente. Como afirmó Diaz, Felipe fue el primero en denunciar la mina pero sus derechos los venció el señor Fulgencio Benítez a cuyo nombre se expidió el título arriba mencionado. Por las razones expuestas, la Intendencia resolvió suspender indefinidamente el curso del denuncio de la mina Playa De Oro presentado por el señor Lucas Díaz.",Deteriorado. La mayoría de las páginas está rota.,,,"Descrito por Yurleyda Perea Cuesta el 2023-02-02, revisado por Daniel Varela Corredor y Kelly López Roldán el 2024-02-20",AHJCI.MFC.008,AHJCI.MFC,Caja 8,"Esta caja contiene 14 procesos judiciales iniciados entre 1926 y 1930 en la cuenca del río San Juan. Incluye varios casos por posesión y propiedad minera, e involucra actores como la Compañía Minera Chocó Pacífico, Antonio Asprilla, Hermenegildo Bonilla y Rito E. Florez. También hay casos de cobros y heridas, y se incluye algunos conflictos familiares como la división de un terreno agrícola al interior de una familia indígena y un juicio de separación de bienes en una sociedad conyugal sin implicar divorcio.
 ",1926 - 1930,1930
AHJCI.MFC.008.012,Ernestina Lemos Rentería,EAP1477_MFC_B08_Doc12_BernalvsMosquera,Documento,39 folios de papel,"S.M. Serrano Bernal contra Pedro Ángel Mosquera, cobro","Archivo Histórico del Juzgado del Circuito de Istmina, Fondo Minería y Familia, Caja 9, Documento 12",Tadó|Quibdó|Istmina|Cértegui|Tapón,"Serrano Bernal, S M|Esquivia, Carlos|Moreno, Rudecindo|Ángel Mosquera, Pedro|Mosquera, Juan José|Miller, Ramón|Arango, Ricardo|Bechara, Antonio H|Abadía Arango, Sergio|Mena, Inocencio|Mosquera, Manuel Dolores|Palacios, Alquiles|Lemos, Francisco",,judicial|comercio|mercaderes,"Demanda S. M. Serrano Bernal en su condición de cesionario y apoderado de los señores A. &. T. Meluk & Cía. del comercio de Quibdó. Establece demanda especial, por los trámites ejecutivos, contra la persona y bienes del señor Pedro Ángel Mosquera. Se pide librar orden de pago en contra del deudor por la suma de 2,575.94 de oro americano, por los intereses y mora adquiridos en mercado y abastecimiento de enseres.",Deteriorado. La mayoría de las páginas está rota.,,,"Descrito por Ernestina Lemos Rentería el 2023-02-25, revisado por Daniel Varela Corredor y Kelly López Roldán el 2024-02-20",AHJCI.MFC.008,AHJCI.MFC,Caja 8,"Esta caja contiene 14 procesos judiciales iniciados entre 1926 y 1930 en la cuenca del río San Juan. Incluye varios casos por posesión y propiedad minera, e involucra actores como la Compañía Minera Chocó Pacífico, Antonio Asprilla, Hermenegildo Bonilla y Rito E. Florez. También hay casos de cobros y heridas, y se incluye algunos conflictos familiares como la división de un terreno agrícola al interior de una familia indígena y un juicio de separación de bienes en una sociedad conyugal sin implicar divorcio.
 ",1926 - 1930,1928
AHJCI.MFC.008.013,Nallely Taborda Castañeda,EAP1477_MFC_B08_Doc13_BernalvsCordobaandMoreno,Documento,27 folios de papel,"Luis Enrique Bernal contra Nicanor Córdoba y Juan Francisco Moreno, cesionario de Rito E. Flórez, cobro","Archivo Histórico del Juzgado del Circuito de Istmina, Fondo Minería y Familia, Caja 9, Documento 13",Primavera|Istmina|Dipurdocito|Condoto|Opogodó|Paimadó|Bebedó|Cali,"Bernal, Luis Enrique|Córdoba, Nicanor|Flórez, Rito E|Hurtado, Valentín|M, Lozano|Restrepo, José María|Mesa Prieto, Elías|Córdoba, Eugenio|Asprilla, Eusebio|Castillo, Jaime|Quiterio Gómez, José",,judicial|mercaderes|comercio,"Luis Enrique Bernal denuncia a Nicanor Córdoba y Juan Francisco Moreno, ambos bogas de profesión. Bernal los culpó del naufragio en el punto llamado Bebedó de una canoa en la que ellos conducían mercancías del señor Rito E. Flórez. La pérdida en sus intereses fue justificada de común acuerdo entre perjudicado y perjudicantes en la suma de 608 pesos. Los denunciados se obligaron a pagarle a Rito E. Flórez la suma ya expresada en efectivo y viajes, obligación que no habían cumplido. Se cita a Nicanor y Juan Francisco para que desmientan que los señores Valentín Hurtado y F. Lozano firmaron a ruego de ellos un pagaré, por estos no saber hacerlo, y menos rogaron a los señores José María Restrepo y Elías Mesa Prieto para que firmara como testigos. Es falso también que presentaron como fiador al señor Eugenio Córdoba, pues cuando fue el naufragio de la mercancía fueron llevados a la cárcel varias veces, manifestando al señor Flórez y al señor Córdoba que no firmaban compromisos de ninguna clase y que preferían consumirse en la cárcel. Por eso no reconocen el documento. ",,,,"Descrito por Nallely Taborda Castañeda el 2023-02-01, revisado por Daniel Varela Corredor y Kelly López Roldán el 2024-02-20",AHJCI.MFC.008,AHJCI.MFC,Caja 8,"Esta caja contiene 14 procesos judiciales iniciados entre 1926 y 1930 en la cuenca del río San Juan. Incluye varios casos por posesión y propiedad minera, e involucra actores como la Compañía Minera Chocó Pacífico, Antonio Asprilla, Hermenegildo Bonilla y Rito E. Florez. También hay casos de cobros y heridas, y se incluye algunos conflictos familiares como la división de un terreno agrícola al interior de una familia indígena y un juicio de separación de bienes en una sociedad conyugal sin implicar divorcio.
 ",1926 - 1930,1930
AHJCI.MFC.008.014,Javier Hurtado Ibargüen,EAP1477_MFC_B08_Doc14_BonillavsMoreno,Documento,42 folios de papel,"Hermenegildo Bonilla contra Isabelino, José Gil, y Nicomedes Moreno (mieleros) por propiedad de terreno a orillas del río Tamaná","Archivo Histórico del Juzgado del Circuito de Istmina, Fondo Minería y Familia, Caja 9, Documento 14",Tamaná|Nóvita|Cundinamarca|Río Viejo|Panamá,"Bonilla, Hermenegildo|Moreno, Isabelino|Gil Moreno, José|Moreno, Nicomedes|Garavito, Fernando|Calderón, Víctor Manuel|Murillo, Salvador|Girón, Saturnino|Asprilla, Saturnina|Moreno, Juan Evangelista|Murillo, Petrona|Moreno, Agustín|Eleuterio Murillo, José|Murillo, Isidoro|Murillo, Ángel María|Asprilla, Juan Domingo|Asprilla, Delfina|Asprilla, Escolástica|Asprilla, Ambrosio|Rivas, María Teresa|Diego, Floriano de|Garcés, Manuel",,judicial|tierras|división territorial,"El documento nos presenta un caso en el que se debate sobre la propiedad y tenencia de unos terrenos entre Hermenegildo Bonilla contra Isabelino, José Gil y Nicomedes Moreno.

Bonilla dice poseer unos terrenos en el río Tamaná que compró en el año 1918 y de los cuales tiene escrituras públicas. Todos estos terrenos están bien demarcados geográficamente y fueron obtenidos por medio de unas compras que Bonilla hizo a los hijos herederos legítimos de dos parejas que habían fallecido.

La problemática se presenta porque Francisco Moreno inició a construir una vivienda en uno de los terrenos de Bonilla. Cuando este se dio cuenta puso una querella ante el alcalde de Nóvita quien falla a su favor y pidió a Moreno que parase dicha construcción. Moreno dijo que estaba construyendo porque Isabelino, José Gil y Nicomedes Moreno le habían dicho que ese predio era de ellos, y además se lo habían arrendado por un año, pero que este aún no contaba con el contrato porque aún no se había expedido. Debido a esta situación y al reclamo de las dos partes por dichos terrenos, desde la alcaldía se abrió un juicio para que las partes involucradas y quienes crean tener derechos en estos terrenos presentasen las pruebas que sean necesarias para resolverlo.
 
Cuando el juicio inicia, Bonilla presenta todas sus pruebas en las que demuestra que había comprado legalmente dichos terrenos y que le pertenecían.",,,,"Descrito por Javier Hurtado Ibargüen el 2023-01-19, revisado por Daniel Varela Corredor y Kelly López Roldán el 2024-02-20",AHJCI.MFC.008,AHJCI.MFC,Caja 8,"Esta caja contiene 14 procesos judiciales iniciados entre 1926 y 1930 en la cuenca del río San Juan. Incluye varios casos por posesión y propiedad minera, e involucra actores como la Compañía Minera Chocó Pacífico, Antonio Asprilla, Hermenegildo Bonilla y Rito E. Florez. También hay casos de cobros y heridas, y se incluye algunos conflictos familiares como la división de un terreno agrícola al interior de una familia indígena y un juicio de separación de bienes en una sociedad conyugal sin implicar divorcio.
 ",1926 - 1930,1926
