id,cataloger,digital_folder,description_level,volume_support,document_title,physical_reference,locations_mentioned,people_mentioned,institutions_mentioned,related_topics,document_summary,physical_issues,digitization_issues,cataloging_notes,review_date,collection_idno,parent_collection,collection_title,collection_description,collection_date,date
AHJCI.MFC.008.001,Yurleyda Perea Cuesta,EAP1477_MFC_B08_Doc01_civiles,Documento,11 folios de papel,Copiador de demandas civiles,"Archivo Histórico del Juzgado del Circuito de Istmina, Fondo Minería y Familia, Caja 8, Documento 1",Istmina|Bogotá|Berna|Terreno El Estanque|Condoto|Quebrada Pichindé|Río Iró|Zanjón del Ají|Quebrada La Bolsa|Quebrada Mandé|Lote Mandinga|Lote La Bolsa|Tadó|Parque El Salto|Corregimiento de Pureto,"Gamboa, Nicolás|Holguín, Ricardo|Holguín, Julio|Holguín, Rafael|Holguín Arboleda, Jorge|Holguín, Pablo|Rappel, Sofia Holguín de|Urrutia, Helena Holguín de|López, Cecilia Holguín de|Franco, Matilde Holguín de|Vargas, Celina Holguín de|A, Frank|Rappel|Urrutia, Francisco J|López Pumarejo, Eduardo|Franco, Roberto|Vargas, Eusebio|Mosquera de Arboleda, Sofía|Arboleda de Holguín, Cecilia|Holguín, Jorge|Arboleda, Julio|Arboleda, Gonzalo|Arboleda, Enrique|Arizala, Andrés|Marshall, Newton C|Góngora, Luis E|Delgado, Moisés|Lloreda, Alberto|David Delgado, José|Copete de Perea, Bárbara|Perea, Dimas|Perea, Isabel",,administración-judicial|minas|minería,"Este documento es un copiador de demandas civiles que consta de tres demandas. 

La primera trata sobre un juicio de sucesión de la señora Sofía Mosquera de Holguín en favor de sus hijos, cada uno de los cuales fue beneficiado en una undécima parte a excepción del heredero Ricardo Holguín, a quien se le otorgó dos undécimas partes, entre otros bienes.

El segundo expediente trata sobre demanda interpuesta ante el juzgado de Tadó por Luis E. Góngora, apoderado de Alberto Lloreda, contra Moisés Delgado. Por escritura que ya expiró, Lloreda le confiere poder general a Luis E. Góngora para representarlo en todos los juicios que se le citen, ya que él fue víctima de acto por lanzamiento o despojo violento verificado por el alcalde de Tadó. Lloreda, desde 1919, entró en la propiedad con el nombre de El Salto con el beneplácito del finado José David Delgado, padre de Moisés. Mientras este señor estuvo vivo, trabajó en esa propiedad en carácter de minero.

Moisés y su padre mediaron relaciones de comercio para explotación de minas, el cual sería administrado por Alberto Lloreda. Así continuaron las cosas hasta que dejó de existir José y entró a ser heredero y albacea testamentario Moisés, autor del violento acontecimiento contra Lloreda. Entre éste y Delgado se cruzaron cartas en donde consta que tanto padre como hijo dejaron el dominio absoluto a Lloreda: “con lo que se llega a la conclusión, que Alberto Lloreda no es ningún arrendatario ni poseedor violento o clandestino y como este es otro atropello suyo incalificable, yo, como apoderado, solicito de usted señor juez, el curso de este negocio en la forma que prescribe en artículo 436 del código de minas, que no es otro, que: ‘el de hacer volver las cosas a su estado anterior bajo el preciso término de 24 horas’”, solicita Góngora.

La tercera demanda trata sobre un juicio por lesión. Ante el juez de Istmina, el personero de la señora Bárbara Copete, cuenta que: “el 21 de abril de 1911, en la iglesia de Tadó, contrajo matrimonio la señora Bárbara y Dimas Perea”. Antes de ese matrimonio, la señora Copete no hizo renuncia de los derechos a los gananciales que se obtuvieran en la constitución de la sociedad conyugal, por lo tanto, es parte directa en todos los asuntos de su esposo. Ninguno aportó bienes a la sociedad conyugal a excepción de una casita pajiza que Perea adquirió un año antes. Tenían cuatro hijos, y para tener qué dejarle a sus hijos y esposa, Perea vendió él inmueble a su madre Isabel Perea por la ridícula cantidad de 400 pesos, lo que lesiona enormemente el valor de la propiedad y los derechos de la sociedad que ellos tienen. Bárbara pide se establezca juicio de partición de bienes.",,,,"Descrito por Yurleyda Perea Cuesta el 2023-01-25, revisado por Daniel Varela Corredor y Kelly López Roldán el 2024-02-20",AHJCI.MFC.008,AHJCI.MFC,Caja 8,"Esta caja contiene 14 procesos judiciales iniciados entre 1926 y 1930 en la cuenca del río San Juan. Incluye varios casos por posesión y propiedad minera, e involucra actores como la Compañía Minera Chocó Pacífico, Antonio Asprilla, Hermenegildo Bonilla y Rito E. Florez. También hay casos de cobros y heridas, y se incluye algunos conflictos familiares como la división de un terreno agrícola al interior de una familia indígena y un juicio de separación de bienes en una sociedad conyugal sin implicar divorcio.
 ",1926 - 1930,1928
AHJCI.MFC.008.002,Ernestina Lemos Rentería,EAP1477_MFC_B08_Doc02_civiles,Documento,5 folios de papel,Juicios civiles que salen transitoriamente en 1928,"Archivo Histórico del Juzgado del Circuito de Istmina, Fondo Minería y Familia, Caja 8, Documento 2",Istmina|Bogotá,"Ayala de Quintana, Paula|Restrepo, José|Robledo Villa, Félix|Arcila, Salvador|Asprilla, Alcides|Gómez, Francisca v de|Asprilla, Antonio|García, Manuel|Salazar, Constantino|Mosquera, Claudia|Jaramillo, Abraham|Moreno, Rudecindo|Abadía, Arístides|Guerrero, Clobulo de la Roche y|Murillo, Salomón|Salazar Peréz, Constantino|Flórez, Pantaleón|Castillo, Jaime|Mosquera, Manuel Ignacio|Peralta, Jorge|Palacios, Angel Pío|Minita, Antonio|Palacios, Jorge|Guerrero, Luis|Coutin, Gilberto|Mosquera, María Isidora|Serrano Bernal, Manuel|Mosquera, Valentín|Martínez, Aureliano|Rentería, Rogelio|Lozano, Manuel José|Tobar, Ana Dolores|Palacios, Martín|Leudo, Jesús María|Posos, Antonio|Bechara, Antonio E|Mena, Efrén|Lozano, Pablo|Delgado, Antonio María|Perea de Mosquera, Angelina|Mosquera, Juan Antonio|Severo Mosquera, Antonio",,administración-judicial,"Este documento parece ser una recopilación de los juicios civiles llevados a cabo en el año 1928. Solo se trata de la descripción de los casos y no de los expedientes completos. Por ejemplo: Demanda ordinaria por pesos, José Restrepo contra Salvador Arcila; Reconocimiento de un vale, Félix Robledo Villa contra Alcides Asprilla; Juicio ejecutivo por pesos, Jorge Salazar contra Antonio Asprilla A; Petición de Francisca viuda de Gómez sobre adopción de señorita Dolores Gómez; Oposición a la posesión de la mina del Rosario por Antonio Asprilla contra Manuel Garcés; Juicio ordinario sobre pago de honorarios, Constantino Salazar contra Claudia Mosquera; y así sucesivamente.",,No se ve la regla y el balance de blancos.,,"Descrito por Ernestina Lemos Rentería el 2023-01-16, revisado por Daniel Varela Corredor y Kelly López Roldán el 2024-02-20",AHJCI.MFC.008,AHJCI.MFC,Caja 8,"Esta caja contiene 14 procesos judiciales iniciados entre 1926 y 1930 en la cuenca del río San Juan. Incluye varios casos por posesión y propiedad minera, e involucra actores como la Compañía Minera Chocó Pacífico, Antonio Asprilla, Hermenegildo Bonilla y Rito E. Florez. También hay casos de cobros y heridas, y se incluye algunos conflictos familiares como la división de un terreno agrícola al interior de una familia indígena y un juicio de separación de bienes en una sociedad conyugal sin implicar divorcio.
 ",1926 - 1930,1928
AHJCI.MFC.008.003,Nallely Taborda Castañeda,EAP1477_MFC_B08_Doc03_JavevsJave,Documento,12 folios de papel,"Martín Jave, mujer indígena, contra Juan José, María Teresa, María Duvina, Manuela y Cupertino Jave, nulidad de una escritura pública sobre división de terreno","Archivo Histórico del Juzgado del Circuito de Istmina, Fondo Minería y Familia, Caja 8, Documento 3",Dipurdú de los Indios|Istmina,"Abadía, Arístides|Jave, Vicente|Jave, Juan José|Jave, María Teresa|Eduvina Jave, María|Jave, Manuela|Jave, Cupertino|Arboleda, Sofia de|Sierra, Roberto|Jave, María Martina",,judicial|distribución territorial,"María Martina, mujer indígena condueña y comunera en los terrenos de Dipurdú de los Indios, pone como apoderado a Aristóteles Abadía para que demande la nulidad de unas escrituras públicas donde consta una partición amigable verificadas por lo parientes y comuneros de esos terrenos sin anunciar a ella y a otros condueños también comuneros del mismo terreno. Arístides pide entonces la demanda contra Vicente, Juan José; María Teresa; María Eduvina; Manuela y Cupertino todos del mismo apellido Jave, por no citar colindantes ni miembros de los comuneros. Los demandados aceptan la demandan y además manifiestan que la partición que hicieron sin tener conocimiento, es decir, que abusaron de su ignorancia. ","Deteriorado. Presenta roturas, los números de folio son ilegibles.",,,"Descrito por Nallely Taborda Castañeda el 2023-01-30, revisado por Daniel Varela Corredor y Kelly López Roldán el 2024-02-20",AHJCI.MFC.008,AHJCI.MFC,Caja 8,"Esta caja contiene 14 procesos judiciales iniciados entre 1926 y 1930 en la cuenca del río San Juan. Incluye varios casos por posesión y propiedad minera, e involucra actores como la Compañía Minera Chocó Pacífico, Antonio Asprilla, Hermenegildo Bonilla y Rito E. Florez. También hay casos de cobros y heridas, y se incluye algunos conflictos familiares como la división de un terreno agrícola al interior de una familia indígena y un juicio de separación de bienes en una sociedad conyugal sin implicar divorcio.
 ",1926 - 1930,1927
AHJCI.MFC.008.004,Javier Hurtado Ibargüen,EAP1477_MFC_B08_Doc04_AsprillavsQuiñonez,Documento,12 folios de papel,Antonio Asprilla contra Pacífico Quiñónez por propiedad de terrenos de Marcos Díaz,"Archivo Histórico del Juzgado del Circuito de Istmina, Fondo Minería y Familia, Caja 8, Documento 4",Opogodó|Istmina|San Juan|Bajo San Juan,"Asprilla, Antonio|Quiñones, Pacífico|Díaz, Mario|Abadía, Arístides|Mosquera, Manuel Antonio|Moreno, Valeriana|Moreno, Pastora|A, Justo|Quintero|Quintana, Rodolfo|Asprilla Abadia, Israel|Miller, Ramón|Salas, Rafael",,judicial|tierras|comercio|mercaderes,"Antonio Asprilla había instaurado una denuncia contra Pacifico Quiñones por perturbación de terrenos en posesión de Asprilla. Debido a este denuncio que reposaba en la alcaldía de Nóvita se citó a Quiñones para que compareciera y diera sus declaraciones frente a las acusaciones.

Cuando Quiñones se presenta a las instalaciones de la alcaldía, como no estaba el alcalde, quien andaba de gira por el Bajo San Juan, habla ante el secretario Manuel Antonio Asprilla, quien lo suplantaba. Quiñones manifiesta que los terrenos por los cuales se le denuncia son de su propiedad, pues fueron heredados por su esposa y suegra y por lo cual estaba facultado para trabajarlos. Este caso toma un giro interesante pues cuando Quiñones termina de declarar el secretario le pide que debe tener un fiador, Quiñones propone a Arístides Abadía, a lo cual el secretario se negó con el argumento de que esa persona es muy vieja y no cumple con los requisitos para ser un fiador y por lo tanto lo iba a mandar a la cárcel, tal como lo hizo.

Es así que el señor Arístides Abadía denuncia al secretario Manuel Antonio Mosquera por abuso de autoridad y atentado contra los derechos individuales. Alega Abadía que Mosquera no tenía la facultad de tomar tales atribuciones contra Quiñones, pues no era la persona facultada para mandar a encarcelar a una persona. Desafortunadamente el caso no avanza porque Manuel Antonio murió en 1929.",,,,"Descrito por Javier Hurtado Ibargüen el 2022-11-09, revisado por Daniel Varela Corredor y Kelly López Roldán el 2024-02-20",AHJCI.MFC.008,AHJCI.MFC,Caja 8,"Esta caja contiene 14 procesos judiciales iniciados entre 1926 y 1930 en la cuenca del río San Juan. Incluye varios casos por posesión y propiedad minera, e involucra actores como la Compañía Minera Chocó Pacífico, Antonio Asprilla, Hermenegildo Bonilla y Rito E. Florez. También hay casos de cobros y heridas, y se incluye algunos conflictos familiares como la división de un terreno agrícola al interior de una familia indígena y un juicio de separación de bienes en una sociedad conyugal sin implicar divorcio.
 ",1926 - 1930,1927
AHJCI.MFC.008.005,Ernestina Lemos Rentería,EAP1477_MFC_B08_Doc05_CopetevsPerea,Documento,13 folios de papel,"Bárbara Copete contra Dimas Perea, demanda sobre separación de poderes","Archivo Histórico del Juzgado del Circuito de Istmina, Fondo Minería y Familia, Caja 8, Documento 5",Istmina|Tadó|Cali|Río San Juan,"Copete de Perea, Bárbara|Perea, Dimas|Bernal, S M|Copete, Manuel María|Salazar, Demetrio|Ledesma, Petrona|Gonzalo Perea, Israel|Isabel Perea, María Heliodora|Adonicet Perea, Máximo|Adonicet Perea, Apolónides|Mosquera Flórez, Crisóstomo|Mosquera, Anunciación|Mosquera, Diego|Mosquera Mosquera, Manuel Alberto|Mosquera, Lina|Mosquera, Germán|Mosquera, Pedro Manuel|Robledo, Beatriz|Perea, Isabel|Henao, Pablo|Lozano, Indalecio|Castillo, Jaime|Echeverri Ferrer, Ricardo|Valois, Rutilio|Leudo, Inocencio",,judicial,"Demanda ordinaria sobre separación de bienes por parte de Bárbara Copete de Perea contra Dimas Perea, “esposos”. Antes del matrimonio tuvieron un hijo llamado Israel Gonzalo, y dentro del matrimonio a María Heliodoro, Isabel, Máximo y Apolónides Adonicet, los cuales Vivian y eran sostenidos por parte de su madre debido al total abandono de su padre, Dimas Perea. Durante la sociedad conyugal se edificó en la población de Tadó una casa de dos pisos, de techo de zinc, pisos de madera aserrada y paredes de guadua y tabla aserrada. Supuestamente para privar a su esposa y a sus hijos del único bien que, como fruto del trabajo de la demandante, casi en su totalidad, se ha obtenido en la sociedad, ficticiamente y por un precio menor a la quinta parte de él, había simulado una venta Dimas Perea a favor de su madre Isabel Perea, pero tal venta la ha demandado la demandante del caso por lesión enorme. Ella también asegura que el trato cruel hacia ella y a sus hijos por parte de su esposo, la disipación de lo que ganaba en los estancos y estanquillos, la embriaguez permanente, motivaron que ella lo dejará, pero exige el derecho que ella tenía a esa propiedad que consideraba había sido injustamente vendida. ",,,,"Descrito por Ernestina Lemos Rentería el 2022-11-09, revisado por Daniel Varela Corredor y Kelly López Roldán el 2024-02-20",AHJCI.MFC.008,AHJCI.MFC,Caja 8,"Esta caja contiene 14 procesos judiciales iniciados entre 1926 y 1930 en la cuenca del río San Juan. Incluye varios casos por posesión y propiedad minera, e involucra actores como la Compañía Minera Chocó Pacífico, Antonio Asprilla, Hermenegildo Bonilla y Rito E. Florez. También hay casos de cobros y heridas, y se incluye algunos conflictos familiares como la división de un terreno agrícola al interior de una familia indígena y un juicio de separación de bienes en una sociedad conyugal sin implicar divorcio.
 ",1926 - 1930,1928
AHJCI.MFC.008.006,Yurleyda Perea Cuesta,EAP1477_MFC_B08_Doc06_JaramillovsGomez,Documento,161 folios de papel,"Julio Jaramillo contra Juan de D. Gómez, liquidación de sociedad comercial","Archivo Histórico del Juzgado del Circuito de Istmina, Fondo Minería y Familia, Caja 8, Documento 6",Playa de Oro|Tadó|Bogotá|Medellín|Istmina|Condoto|La Soledad,"Echeverri, Clímaco|Jaramillo, Julio|Mena, Dociteo|Guzmán, Sotero|Mosquera, Rosendo|Arango, Vicente|Restrepo, Ramón|Lozano, Catalino|Andrade, Alejandro|Palacio, Jacinto|Murillo, Cantalicio|Lloreda, Cayetano|Mena, Crescencio|Lemos, Sergio|Mosquera, Pedro Manuel|Roa, Pompilio|Camacho, Moisés|Córdoba, Apolonides|Moreno, Eduardo|Moreno, Narciso|Lloreda, David|Gómez, Juan de Dios|Rentería, Adriano|Guevara, Julio|Gil, Silvestre|Mosquera, Pedro Pablo|Almojón, Prospero|Cárdenas, Obdulio|Cárdenas, Julio|Gómez, Rafael",,judicial|minería|minas,"En junio de 1931, Julio Jaramillo solicitó llevar a cabo un juicio sobre rendición de cuenta contra Juan de Dios Gómez, por las obras emprendidas por este último, en su carácter de administrador de una sociedad que estos tenían bajo el nombre de Jaramillo Gómez para que Juan de Dios laborara en las minas que la sociedad ha tomado en arrendamiento en el municipio de Tadó y a su vez pide se le dé el depósito en persona honorable de las herramientas que pertenecen a la sociedad y de las cuales Juan de Dios ha hecho uso sin permiso y de manera dolosa. Puesto que Gómez no solo usa su antojo los fondos o materiales de la sociedad que tienen común con Jaramillo, sino que está disponiendo venta de los elementos comprados por este, para el laboreo de las minas. Después de revisar la declaración de Jaramillo, el juzgado manifiesta que no está de acuerdo es en el depósito que Jaramillo exige, pero cree que Gómez tiene la obligación de obedecer las órdenes que las autoridades judiciales le impartan, dicen que otra cosa sería haber renunciado a su cargo dentro de la sociedad, pues ahí sí tendría cabida el depósito.","Muy deterioraro, la mayoría de hojas están rotas, lo que compromete seriamente el contenido del expediente.",,,"Descrito por Yurleyda Perea Cuesta el 2023-02-06, revisado por Daniel Varela Corredor y Kelly López Roldán el 2024-02-20",AHJCI.MFC.008,AHJCI.MFC,Caja 8,"Esta caja contiene 14 procesos judiciales iniciados entre 1926 y 1930 en la cuenca del río San Juan. Incluye varios casos por posesión y propiedad minera, e involucra actores como la Compañía Minera Chocó Pacífico, Antonio Asprilla, Hermenegildo Bonilla y Rito E. Florez. También hay casos de cobros y heridas, y se incluye algunos conflictos familiares como la división de un terreno agrícola al interior de una familia indígena y un juicio de separación de bienes en una sociedad conyugal sin implicar divorcio.
 ",1926 - 1930,1930
AHJCI.MFC.008.007,Ernestina Lemos Rentería,EAP1477_MFC_B08_Doc07_IbarguenvsBonilla,Documento,58 folios de papel,Contra Ángel María Ibargüen y Juan Lucio Bonilla por heridas y riña,"Archivo Histórico del Juzgado del Circuito de Istmina, Fondo Minería y Familia, Caja 8, Documento 7",Opogodó|Nóvita|Tigre|Istmina|Cali,"Ibargüen, Ángel María|Lucio Bonilla, Juan|Rentería, Juan Antonio|Córdoba, Macario|Mosquera, Valentín|Murillo, Arcadio|Cuero, Manuel|Ibargüen, Celso|Rivas Ibargüen, Juana Raquel|Ibargüen, Pilar|Herrera, Julio|Ibargüen, Francisco|Gómez, Jesús|Asprilla, Esteba|Quintana, Agustín Antonio|Mosquera, José Mercedes|Bonilla, Hermenegildo|Moreno, Carlos|Bonilla, Juan José|Mosquera, Isabel|A, Manuel|Marin|García, Ángel|Garcés, Vicente|Gómez, Pedro|J, Antonio|Moreno|Rodríguez, Vicente|Castillo, Jaime|Bernat Escobar, Luis E|Mena Caicedo, Aníbal|Lemos, Guillermo A|Cuero, José María|Guerrero, Antonio|Sánchez Nuñez, Jesús|Dualivy, Emilio",,judicial,"Juan Lucio Bonilla denuncia que fue herido por Ángel María Ibargüen, quien con un machete de propiedad de Juan Bonilla le causó tres heridas, una en el antebrazo derecho que mide ocho centímetros de largo, dos centímetros de ancho y tres líneas de profundidad. Otra herida en el mismo brazo en la parte superior que mide tres centímetros de largo, uno de ancho por una línea. La última herida sobre el pecho en el mismo lado, que mide trece centímetros y medio de largo, sin profundidad ni ancho. Esta riña se dio en una mina de alto Opogodó por agua que les abastecía en sus laboreos en la mina. El señor Ángel María, que es el dueño del agua, asegura que él también salió herido en la riña pero que sin ninguna intención quiso lastimar a su compañero, que todo sucedió en el forcejeo que ambos tuvieron. ",Deteriorado. Los números de folio no son legibles.,La imagen 82 tiene una orientación contraria al resto del documento.,,"Descrito por Ernestina Lemos Rentería el 2023-02-06, revisado por Daniel Varela Corredor y Kelly López Roldán el 2024-02-20",AHJCI.MFC.008,AHJCI.MFC,Caja 8,"Esta caja contiene 14 procesos judiciales iniciados entre 1926 y 1930 en la cuenca del río San Juan. Incluye varios casos por posesión y propiedad minera, e involucra actores como la Compañía Minera Chocó Pacífico, Antonio Asprilla, Hermenegildo Bonilla y Rito E. Florez. También hay casos de cobros y heridas, y se incluye algunos conflictos familiares como la división de un terreno agrícola al interior de una familia indígena y un juicio de separación de bienes en una sociedad conyugal sin implicar divorcio.
 ",1926 - 1930,1930
AHJCI.MFC.008.008,Nallely Taborda Castañeda,EAP1477_MFC_B08_Doc08_IbarguenvsMosquera,Documento,21 folios de papel,"Juana Ibargüen de Mosquera contra Manuel Loreto Mosquera, demanda sobre separación de bienes sin divorcio","Archivo Histórico del Juzgado del Circuito de Istmina, Fondo Minería y Familia, Caja 8, Documento 8",Condoto|Istmina|Andagoya|Buenaventura|Tadó,"Ibargüen de Mosquera, Juana|Lotero Mosquera, Manuel|Ortiz, Rodolfo|Mosquera Hijo, Manuel|Abadia Arango, Sergio|Marshall, S|Lozano, Pedro José|Lozano, José Dolores|M|Murillo, Salomón|Lozano, José María|Arias Rivas, Abigail|Murillo, Salomón",,judicial|vida social,"Juana Ibargüen interpuso demanda contra su esposo, Manuel Lotero Mosquera, solicitando la separación de bienes sin divorcio. Nombró como apoderado al señor Rodolfo Ortiz. El matrimonio de estos dos fue en el año 1912. En 1913, Juana fue echada de la casa de habitación que compartía con su esposo. Ella manifiesta que cumplía con sus deberes de esposa acompañándolo en el trabajo, manteniendo la paz y fidelidad, pero caso contrario era su esposo, que hasta la maltrataba al punto de echarla junto con un hijo fruto de este matrimonio de nombre Manuel Mosquera. Juana también manifiesta que se enteraba y veía también como Manuel cometía el delito de amancebamiento al llevar distintas mujeres a la casa de habitación que antes compartía con ella. Las pertenencias que tenía en su poder Manuel eran 300 pesos de plata de 0,835 en efectivo, un paquetico de 13 monedas a diez centavos plata, una higa de lacre engastada en oro, un par de aretes de oro, una cruz de oro, un zarcillo de oro, un jarro de plata, una tachuela de plata y algunos papeles de Mosquera. En 1920 Juana Ibargüen y Manuel Lotero llegan a un acuerdo amigable y Juana desiste en la demanda. ",Deteriorado. Está manchado en la margen superior.,,,"Descrito por Nallely Taborda Castañeda el 2023-01-31, revisado por Daniel Varela Corredor y Kelly López Roldán el 2024-02-20",AHJCI.MFC.008,AHJCI.MFC,Caja 8,"Esta caja contiene 14 procesos judiciales iniciados entre 1926 y 1930 en la cuenca del río San Juan. Incluye varios casos por posesión y propiedad minera, e involucra actores como la Compañía Minera Chocó Pacífico, Antonio Asprilla, Hermenegildo Bonilla y Rito E. Florez. También hay casos de cobros y heridas, y se incluye algunos conflictos familiares como la división de un terreno agrícola al interior de una familia indígena y un juicio de separación de bienes en una sociedad conyugal sin implicar divorcio.
 ",1926 - 1930,1928
AHJCI.MFC.008.009,Javier Hurtado Ibargüen,EAP1477_MFC_B08_Doc09_MenaandGarcia,Documento,4 folios de papel,"Contra Juan Mena y N.N. García, agentes de policía, por abuso de autoridad","Archivo Histórico del Juzgado del Circuito de Istmina, Fondo Minería y Familia, Caja 8, Documento 9",Cértegui|Tadó|Istmina,"Mena, Juan|García, N N|Asprilla, Eusebio|Palacios, Miguel Antonio|Arango, Enriqueta|Narciso|Mosquera|Copete, Julio|Perea, Antonio S|Mosquera, Senen|Posada, José María|Gómez, Francisco|Palacios, Pablo María",,administración-judicial|policía|judicial,"El caso nos presenta una denuncia por los delitos de abuso de autoridad y maltratamiento de obra que le hizo el señor Pablo María Palacios a los policías Juan Mena y N.N García. Palacios aseguraba que los señores policías lo habían acusado de irrespetarlos y de llamarlos despectivamente hijos de puta, cosa que el afectado negó, inclusive estando en el mismo despacho del alcalde de Tadó. Sin contar con alguna respuesta del alcalde y más bien ante su silencio, fue sacado de dicho despacho y golpeado abruptamente a planazos por los policías. Según Palacios, en dicha situación también fue golpeado y encarcelado su hermano Miguel Antonio Palacios, quien al ver la situación intentó intermediar para defenderlo.",,,,"Descrito por Javier Hurtado Ibargüen el 2023-01-19, revisado por Daniel Varela Corredor y Kelly López Roldán el 2024-02-20",AHJCI.MFC.008,AHJCI.MFC,Caja 8,"Esta caja contiene 14 procesos judiciales iniciados entre 1926 y 1930 en la cuenca del río San Juan. Incluye varios casos por posesión y propiedad minera, e involucra actores como la Compañía Minera Chocó Pacífico, Antonio Asprilla, Hermenegildo Bonilla y Rito E. Florez. También hay casos de cobros y heridas, y se incluye algunos conflictos familiares como la división de un terreno agrícola al interior de una familia indígena y un juicio de separación de bienes en una sociedad conyugal sin implicar divorcio.
 ",1926 - 1930,1929
